{
    "$schema": "https://json-schema.org/draft/2019-09/schema",
    "type": "object",
    "properties": {
        "schema": {
            "type": "object",
            "properties": {
                "version": {
                    "type": "string",
                    "enum": [
                        "2023.09.27"
                    ]
                }
            }
        },
        "tags": {
            "type": "object",
            "additionalProperties": {
                "type": "string"
            }
        },
        "endpoints": {
            "type": "array",
            "items": {
                "minItems": 1,
                "type": "object"
            }
        },
        "tool-params": {
            "type": "array",
            "items": {
                "minItems": 0,
                "type": "object"
            }
        },
        "run-params": {
            "type": "object",
	    "properties": {
		"num-samples": {
		    "type": "integer",
		    "minimum": 1
		},
		"max-sample-failures": {
		    "type": "integer",
		    "minimum": 1
		},
		"test-order": {
		    "type": "string",
		    "enum": [
			"s",
			"i",
			"r"
		    ]
		}
	    },
	    "additionalProperties": false,
	    "required": []
        },
        "benchmarks": {
            "type": "array",
            "minItems": 1,
            "items": {
                "type": "object",
                "properties": {
                    "name": {
                        "type": "string"
                    },  
                    "ids": {
			"$ref": "#/definitions/number-lists"
                    },
                    "mv-params": {
                        "anyOf": [
                            {
                                "type": "array",
                                "items": {
                                    "minItems": 1,
                                    "type": "object"
                                }
                            },
                            {
                                "type": "object"
                            }
                        ]
                    }
                },
                "additionalProperties": false,
                "required": [
                    "name",
                    "ids",
                    "mv-params"
                ]
            }
        }
    },
    "additionalProperties": false,
    "required": [
        "benchmarks"
    ],
    "definitions": {
        "number-lists": {
            "anyOf": [
                {
                    "type": "string",
                    "pattern": "^(([1-9][0-9]*)(-[1-9][0-9]*)?)(\\+(([1-9][0-9]*)(-[1-9][0-9]*)?))*$"
                },
                {
                    "type": "integer"
                },
                {
                    "type": "array",
                    "minItems": 1,
                    "items": {
                        "anyOf": [
                            {
                                "type": "string",
                                "pattern": "^(([1-9][0-9]*)(-[1-9][0-9]*)?)$"
                            },
                            {
                                "type": "integer"
                            }
                        ]
                    }
                }
            ]
        }
    }
}
