{
    "benchmarks": [
        {
            "name": "iperf",
            "ids": "1-2",
            "mv-params": {
                "global-options": [
                    {
                        "name": "required",
                        "params": [
			    { "arg": "time", "vals": [ "10" ], "role": "client" },
			    { "arg": "protocol", "vals": [ "tcp" ] },
			    { "arg": "bitrate", "vals": [ "0" ] },
			    { "arg": "ifname", "vals" : [ "default-route" ], "role": "server" }
                        ]
                    }
                ],
                "sets": [
                    {
                        "include": "required",
                        "params": [
			    { "arg": "length", "vals": [ "256", "1024" ] }
                        ]
                    }
                ]
            }
        }
    ],
    "tool-params": [
        {
            "tool": "sysstat"
        },
        {
            "tool": "procstat"
        },
        {
            "tool": "kernel",
            "params": [
                {
                    "arg": "subtools",
                    "val": "turbostat"
                }
            ]
        }
    ],
    "tags": {
        "description": "iperf-remotehosts-run-file-json"
    },
    "endpoints": [
	{
	    "type": "remotehosts",
	    "settings": {
		"user": "CI_ENDPOINT_USER",
		"controller-ip-address": "CONTROLLER_IP"
	    },
	    "remotes": [
		{
		    "engines": [
			{ "role": "client", "ids": [ 1 ] },
			{ "role": "server", "ids": [ 1 ] }
		    ],
		    "config": {
			"host": "CI_ENDPOINT_HOST",
			"settings": {
			    "osruntime": "podman"
			}
		    }
		},
		{
		    "engines": [
			{ "role": "client", "ids": [ 2 ] },
			{ "role": "server", "ids": [ 2 ] }
		    ],
		    "config": {
			"host": "CI_ENDPOINT_HOST",
			"settings": {
			    "osruntime": "chroot"
			}
		    }
		}
	    ]
	}
    ],
    "run-params": {
	    "num-samples": 1,
	    "test-order": "s"
    }
}
