{
    "benchmarks": [
        {
            "name": "uperf",
            "ids": "1-2",
            "mv-params": {
                "global-options": [
                    {
                        "name": "required",
                        "params": [
                            { "arg": "protocol", "vals": [ "tcp" ], "role": "client" },
                            { "arg": "wsize", "vals": [ "64" ], "role": "client" },
                            { "arg": "rsize", "vals": [ "64" ], "role": "client" },
                            { "arg": "duration", "vals": [ "10" ], "role": "client" },
                            { "arg": "ifname", "vals" : [ "default-route" ], "role": "server" }
                        ]
                    }
                ],
                "sets": [
                    {
                        "include": "required",
                        "params": [
                            { "arg": "test-type", "vals": [ "stream" ], "role": "client" },
                            { "arg": "nthreads", "vals": [ "1", "8" ], "role": "client" }
                        ]
                    }
                ]
            }
        }
    ],
    "tool-params": [
        {
            "tool": "sysstat"
        },
        {
            "tool": "procstat"
        }
    ],
    "tags": {
        "description": "uperf-k8s-run-file-json"
    },
    "endpoints": [
        {
            "type": "k8s",
            "controller-ip": "CONTROLLER_IP",
            "host": "CI_ENDPOINT_HOST",
            "user": "CI_ENDPOINT_USER",
            "server": "1-2",
            "client": "1-2"
        }
    ],
    "run-params": {
	    "num-samples": 1,
	    "test-order": "s"
    }
}
