{
    "benchmarks": [
	{
	    "name": "iperf",
	    "ids": "1-10+21-30",
	    "mv-params": {
		"global-options": [
		    {
			"name": "required",
			"params": [
			    { "arg": "time", "vals": [ "10" ], "role": "client" },
			    { "arg": "protocol", "vals": [ "tcp" ] },
			    { "arg": "bitrate", "vals": [ "0" ] },
			    { "arg": "ifname", "vals": [ "default-route" ], "role": "server" }
			]
		    }
		],
		"sets": [
		    {
			"include": "required",
			"params": [
			    { "arg": "length", "vals": [ "256" ] }
			]
		    }
		]
	    }
	},
	{
	    "name": "uperf",
	    "ids": [
		"11-20",
		"31-39",
		40
	    ],
	    "mv-params": {
		"global-options": [
		    {
			"name": "required",
			"params": [
			    { "arg": "protocol", "vals": [ "tcp" ], "role": "client" },
			    { "arg": "wsize", "vals": [ "256" ], "role": "client" },
			    { "arg": "rsize", "vals": [ "256" ], "role": "client" },
			    { "arg": "duration", "vals": [ "10" ], "role": "client" },
			    { "arg": "ifname", "vals" : [ "default-route" ], "role": "server" }
			]
		    }
		],
		"sets": [
		    {
			"include": "required",
			"params": [
			    { "arg": "test-type", "vals": [ "stream" ], "role": "client" },
			    { "arg": "nthreads", "vals": [ "1" ], "role": "client" }
			]
		    }
		]
	    }
	}
    ],
    "tags": {
	"foo": "bar"
    },
    "tool-params": [],
    "endpoints": [
	{
	    "type": "k8s",
	    "controller-ip": "K8S_CONTROLLER_IP",
	    "host": "K8S_ENDPOINT_HOST_1",
	    "user": "K8S_ENDPOINT_USER_1",
	    "userenv": "rhubi9",
	    "unique-project": 1,
	    "kubeconfig": 0,
	    "server": "1-10+31-40",
	    "client": [
		"11-20",
		"21-29",
		30
	    ],
	    "config": [
		{
		    "targets": [
			{ "role": "server", "ids": "1-10+31-40" }
		    ],
		    "settings": {
			"nodeSelector": {
                            "kubernetes.io/hostname": "worker-001"
                        }
		    }
		},
		{
		    "targets": [
			{ "role": "client", "ids": [ "11-20", "21-29", 30 ] }
		    ],
		    "settings": {
			"nodeSelector": {
                            "kubernetes.io/hostname": "worker-002"
                        }
		    }
		}
	    ]
	},
	{
	    "type": "k8s",
	    "controller-ip": "K8S_CONTROLLER_IP",
	    "host": "K8S_ENDPOINT_HOST_2",
	    "user": "K8S_ENDPOINT_USER_2",
	    "userenv": "rhubi9",
	    "unique-project": 1,
	    "kubeconfig": 0,
	    "server": [
		11,
		"12-20",
		"21-30"
	    ],
	    "client": "1-10+31-40",
	    "config": [
		{
		    "targets": [
			{ "role": "server", "ids": [ 11, "12-20", "21-30" ] }
		    ],
		    "settings": {
			"nodeSelector": {
                            "kubernetes.io/hostname": "worker-003"
                        }
		    }
		},
		{
		    "targets": [
			{ "role": "client", "ids": "1-10+31-40" }
		    ],
		    "settings": {
			"nodeSelector": {
                            "kubernetes.io/hostname": "worker-004"
                        }
		    }
		}
	    ]
	}
    ],
    "run-params": {
	"num-samples": 1,
	"test-order": "s"
    }
}
