{
    "benchmarks": [
        {
            "name": "sleep",
            "ids": "1-2",
            "mv-params": {
                "global-options": [
                    {
			"name": "required",
			"params": [
			    { "arg": "seconds", "vals": [ "10" ] }
			]
                    }
                ],
                "sets": [
                    {
			"include": "required"
                    }
                ]
            }
        }
    ],
    "tool-params": [
        {
            "tool": "sysstat"
        },
        {
            "tool": "procstat"
        },
        {
            "tool": "kernel",
            "params": [
                {
                    "arg": "subtools",
                    "val": "turbostat"
                }
            ]
        }
    ],
    "tags": {
        "description": "sleep-k8s-run-file-json"
    },
    "endpoints": [
        {
            "type": "k8s",
            "controller-ip": "CONTROLLER_IP",
            "host": "CI_ENDPOINT_HOST",
            "user": "CI_ENDPOINT_USER",
            "client": "1-2"
        }
    ],
    "run-params": {
	    "num-samples": 1,
	    "test-order": "s"
    }
}
