{
    "benchmarks": [
        {
            "name": "sleep",
            "ids": "1-2",
            "mv-params": {
                "global-options": [
                    {
			"name": "required",
			"params": [
			    { "arg": "seconds", "vals": [ "10" ] }
			]
                    }
                ],
                "sets": [
                    {
			"include": "required"
                    }
                ]
            }
        }
    ],
    "tool-params": [
        {
            "tool": "sysstat"
        },
        {
            "tool": "procstat"
        },
        {
            "tool": "kernel",
            "params": [
                {
                    "arg": "subtools",
                    "val": "turbostat"
                }
            ]
        }
    ],
    "tags": {
        "description": "sleep-remotehosts-run-file-json"
    },
    "endpoints": [
	{
	    "type": "remotehosts",
	    "settings": {
		"user": "CI_ENDPOINT_USER",
		"controller-ip-address": "CONTROLLER_IP"
	    },
	    "remotes": [
		{
		    "engines": [
			{ "role": "client", "ids": [ 1 ] }
		    ],
		    "config": {
			"host": "CI_ENDPOINT_HOST",
			"settings": {
			    "osruntime": "podman"
			}
		    }
		},
		{
		    "engines": [
			{ "role": "client", "ids": [ 2 ] }
		    ],
		    "config": {
			"host": "CI_ENDPOINT_HOST",
			"settings": {
			    "osruntime": "chroot"
			}
		    }
		}
	    ]
	}
    ],
    "run-params": {
	    "num-samples": 1,
	    "test-order": "s"
    }
}
