{
    "benchmarks": [
        {
            "name": "uperf",
            "ids": "1-2",
            "mv-params": {
                "global-options": [
                    {
                        "name": "required",
                        "params": [
                            { "arg": "protocol", "vals": [ "tcp" ], "role": "client" },
                            { "arg": "wsize", "vals": [ "64" ], "role": "client" },
                            { "arg": "rsize", "vals": [ "64" ], "role": "client" },
                            { "arg": "duration", "vals": [ "10" ], "role": "client" },
                            { "arg": "ifname", "vals" : [ "default-route" ], "role": "server" }
                        ]
                    }
                ],
                "sets": [
                    {
                        "include": "required",
                        "params": [
                            { "arg": "test-type", "vals": [ "stream" ], "role": "client" },
                            { "arg": "nthreads", "vals": [ "1", "8" ], "role": "client" }
                        ]
                    }
                ]
            }
        }
    ],
    "tool-params": [
        {
            "tool": "sysstat"
        },
        {
            "tool": "procstat"
        },
        {
            "tool": "kernel",
            "params": [
                {
                    "arg": "subtools",
                    "val": "turbostat"
                }
            ]
        }
    ],
    "tags": {
        "description": "uperf-remotehost-run-file-json"
    },
    "endpoints": [
        {
            "type": "remotehost",
            "controller-ip": "CONTROLLER_IP",
            "host": "CI_ENDPOINT_HOST",
            "user": "CI_ENDPOINT_USER",
            "userenv": "default",
            "server": "1-2",
            "client": "1-2",
            "config": [
                {
                    "targets": [
                        { "role": "client", "ids": "1" },
                        { "role": "server", "ids": "1" }
                    ],
                    "settings": {
                        "osruntime": "podman"
                    }
                },
                {
                    "targets": [
                        { "role": "client", "ids": "2" },
                        { "role": "server", "ids": "2" }
                    ],
                   "settings": {
                        "osruntime": "chroot"
                    }
                }             
            ]
        },
        {
            "type": "remotehost",
            "controller-ip": "CONTROLLER_IP",
            "host": "CI_ENDPOINT_HOST",
            "user": "CI_ENDPOINT_USER",
            "userenv": "default",
            "profiler": "1",
            "config": [
                {
                    "targets": [
                        { "role": "profiler", "ids": "1" }
                    ],
                    "settings": {
                        "osruntime": "chroot"
                    }
                }
            ]
        }
    ],
    "run-params": {
	    "num-samples": 1,
	    "test-order": "s"
    }
}
